"License Number","Status","Type| Dup","Expir. Date","Primary Owner and Premises Addr.","Mailing Addr.","Action","Conditions","Escrow","District Code","Geo Code"
"625687","Issued-Temp.","30","09/03/2021","DBA: YORKVILLE CELLARS                             YORKVILLE CELLARS, LLC                              1170 BEL ARBRES DR,                             REDWOOD VALLEY, CA  95470-9695","PO BOX 1980                              HEALDSBURG, CA  95448-1980","PER","","","27","2300"
"625812","Issued-Temp.","30","09/03/2021","DBA: YAMA SEAFOOD                            EJL ENTERTAINMENT INC                              911 W LAS TUNAS DR,                             SAN GABRIEL, CA  91776-1022","","PER","7","SEPULVEDA ESCROW 10550 SEPULVEDA BLVD STE 105 MISSION HILLS, CA  91345-1957","2","1950"
"625866","Issued-Temp.","30","09/03/2021","DBA: JACK'S MART                            CALI ENTITIES LLC                             7264 N BLACKSTONE AVE,                             FRESNO, CA  93650-1233","","PER","","PLACER TITLE COMPANY 3900 COFFEE RD STE 7 BAKERSFIELD, CA  93308-5051","21","1005"
"626244","Issued-Temp.","30","09/03/2021","DBA: MABEL'S BAR                            MABEL'S BAR LLC                             26328 BOUQUET CANYON RD,                             SANTA CLARITA, CA  91350","","PER","7","","5","1985"
"626287","Issued-Temp.","30","09/03/2021","DBA: HYATT HOUSE EL SEGUNDO                            HIGHGATE CONCESSIONS COMPANY LLC                             810 S DOUGLAS ST,                             EL SEGUNDO, CA  90245-4926","545 E JOHN CARPENTER FREEWAY, STE 1400                              IRVING, TX  75062-3958","PER","","CALIFORNIA BUSINESS ESCROW 1748 MAIN ST ESCALON, CA  95320-1927","3","1919"
"626298","Issued-Temp.","30","09/03/2021","DBA: 7 ELEVEN STORE 39583A                            7 ELEVEN INC                             1130 PECK RD,                             SOUTH EL MONTE, CA  91733-4522","","PER","7","7 ELEVEN INC 330 E LAMBERT RD STE 150 BREA, CA  92821-4128","2","1962"
"626306","Issued-Temp.","30","09/03/2021","DBA: THE STATION                            THE STATION ON CENTRAL LLC                             600 CENTRAL AVE,                             TRACY, CA  95376","","FID","7","CALIFORNIA BUSINESS ESCROW INC 1748 MAIN ST ESCALON, CA  95320-1927","29","3906"