"License Number","Status","Type| Dup","Expir. Date","Primary Owner and Premises Addr.","Mailing Addr.","Action","Conditions","Escrow","District Code","Geo Code"
"609045","Active","12 | 1","04/30/2022","DBA: FINER THINGS COMPANY, THE                            FINER THINGS COMPANY THE                             18618 S FERRIS PL,                             RANCHO DOMINGUEZ, CA  90220-6451","475 WASHINGTON BLVD                              MARINA DEL REY, CA  90292-5287","ORI","7","","3","1900"
"609045","Active","09 | 1","04/30/2022","DBA: FINER THINGS COMPANY, THE                            FINER THINGS COMPANY THE                             18618 S FERRIS PL,                             RANCHO DOMINGUEZ, CA  90220-6451","475 WASHINGTON BLVD                              MARINA DEL REY, CA  90292-5287","ORI","7","","3","1900"
"609045","Active","17 | 1","04/30/2022","DBA: FINER THINGS COMPANY, THE                            FINER THINGS COMPANY THE                             18618 S FERRIS PL,                             RANCHO DOMINGUEZ, CA  90220-6451","475 WASHINGTON BLVD                              MARINA DEL REY, CA  90292-5287","ORI","7","","3","1900"
"609045","Active","20 | 0","04/30/2022","DBA: FINER THINGS COMPANY, THE                            FINER THINGS COMPANY THE                             18618 S FERRIS PL,                             RANCHO DOMINGUEZ, CA  90220-6451","475 WASHINGTON BLVD                              MARINA DEL REY, CA  90292-5287","ORI","7,I","","3","1900"
"609045","Active","18 | 1","04/30/2022","DBA: FINER THINGS COMPANY, THE                            FINER THINGS COMPANY THE                             18618 S FERRIS PL,                             RANCHO DOMINGUEZ, CA  90220-6451","475 WASHINGTON BLVD                              MARINA DEL REY, CA  90292-5287","ORI","7","","3","1900"
"612503","Active","23 | 0","06/30/2021","DBA: NORTHERN PINE BREWING                            NORTHERN PINE BREWING, LLC                             12841 EL CAMINO REAL , STE 301-303,                             SAN DIEGO, CA  92130-2963","326 N HORNE ST                              OCEANSIDE, CA  92054-2810","ORI","7","","9","3710"
"613683","Active","20 | 0","04/30/2022","DBA: ARCO 7049                            BP PRODUCTS NORTH AMERICA INC.                             800 E KETTLEMAN LN,                             LODI, CA  95240-5917","4 CENTERPOINTE DR                              LA PALMA, CA  90623-1015","PER","","","29","3902"
"613708","Active","20 | 0","04/30/2022","BP PRODUCTS NORTH AMERICA INC.                             ,","4 CENTERPOINTE DR                              LA PALMA, CA  90623-1015","PER","","","23","3408"
"613710","Active","20 | 0","04/30/2022","DBA: ARCO 7108                            BP PRODUCTS NORTH AMERICA INC.                             4670 CHURN CREEK RD,                             REDDING, CA  96002","4 CENTERPOINTE DR                              LA PALMA, CA  90623-1015","PER","7","","31","4502"
"613715","Active","20 | 0","08/12/2021","DBA: MARCH LANE SHELL                            BP PRODUCTS NORTH AMERICA INC.                             1206 E MARCH LN,                             STOCKTON, CA  95210-3520","4 CENTERPOINTE DR                              LA PALMA, CA  90623-1015","PER","7","","29","3905"
"614420","Active","41 | 0","04/30/2022","DBA: BURGER LOUNGE                             BURGER LOUNGE III LLC                             19515 NORDHOFF ST STE 5,                             NORTHRIDGE, CA  91324","1917 INDIA ST, STE C                              SAN DIEGO, CA  92101","ORI","7","","5","1933"
"617596","Active","20 | 0","06/30/2021","DBA: 7 ELEVEN 41341                            7 ELEVEN INC                             4415 PACIFIC AVE,                             STOCKTON, CA  95207-7601","PO BOX 219088, ATT: 7 ELEVEN LICENSING                              DALLAS, TX  75221-9088","PER","7","CALIFORNIA BUSINESS ESCROW INC 1748 MAIN ST ESCALON, CA  95320-1927","29","3905"
"617869","Active","70 | 0","04/30/2022","DBA: COURTYARD BY MARRIOTT PETALUMA                            JL CA PETALUMA BEVERAGE LLC                             700 CAULFIELD LN,                             PETALUMA, CA  94952-3486","10632 N SCOTTSDALE RD, STE 503                              SCOTTSDALE , AZ  85254","ORI","","","27","4903"
"619245","Issued-Temp.","30","09/14/2021","DBA: LUCKY'S STEAKHOUSE                            MALUCKY, LLC                             3835 CROSS CREEK RD, 18 & 18A,                             MALIBU, CA  90265-4978","114 E HALEY ST, STE O                              SANTA BARBARA, CA  93101-5323","PER","7","STEWART TITLE 1200 CALIFORNIA ST STE 120 REDLANDS, CA  92374","5","1988"
"619752","Issued-Temp.","30","09/14/2021","ALMERAYA-ESPINOZA, MARIA  EUGENIA ORALIA                             ,","","PER","","","5","1933"
"622072","Active","41 | 0","04/30/2022","DBA: BIBIS SWEET TOMATO PIZZA                            TAPIA RODRIGUEZ PROPERTYS MGMT LLC                             696 4TH ST,                             HOLLISTER, CA  95023-3640","815 TRINKLING CREEK RD                              FELTON, CA  95018-8928","ORI","7","","26","3501"
"622098","Active","47 | 0","04/30/2022","DBA: DOMENICOS RESTAURANT                            DOMENICO'S MISSION VIEJO, INC.                             27782 VISTA DEL LAGO, C25 & C26,                             MISSION VIEJO, CA  92692-1175","1900 MAIN ST , STE 700                              C/O MICHAEL CHO, PTWWW, IRVINE, CA  92614-7318","PER/PRM","","ABC ESCROW 2222 DAMON ST LOS ANGELES, CA  90021-2402","11","3027"
"622166","Active","41 | 0","04/30/2022","DBA: HULA'S AT PALM DESERT                            HULA'S AT PALM DESERT INC                              36901 COOK ST, STE 8,                             PALM DESERT, CA  92211-6112","","ORI","","","8","3318"
"622670","Active","20 | 0","04/30/2022","DBA: WESTWOOD FOODMART                            SANDHU, HARPREET KAUR                             671-585 HIGHWAY 36,                             WESTWOOD, CA  96137","682 RIVERCREST PKW                              REDDING, CA  96002","PER","7","CAL SIERRA TITLE 295 MAIN ST QUINCY, CA  95971","31","1800"
"623308","Active","47 | 0","08/12/2021","DBA: TRINITY ALPS GOLF AND COUNTRY CLUB                            TRINITY ALPS GOLF AND COUNTRY CLUB LLC                             130 GOLF COURSE DR,                             WEAVERVILLE, CA  96093","PO BOX 2993                              WEAVERVILLE, CA  96093-2993","PER/PRM","","TRINITY COUNTY TITLE COMPANY 501 MAIN ST WEAVERVILLE, CA  96093","31","5300"
"623667","Active","13 | 0","04/30/2022","DBA: MALPASO, LLC                            MALPASO LLC                              842 FLOWER AVE,                             VENICE, CA  90291-2819","","ORI","7","","3","1933"
"623785","Active","41 | 0","04/30/2022","DBA: ITRIA RESTAURANT                            ITRIA RESTAURANT GROUP LLC                             3266 24TH ST,                             SAN FRANCISCO, CA  94110-3941","645 HAIGHT ST, #5                              SAN FRANCISCO, CA  94117-3314","ORI","","","24","3800"
"624412","Active","41 | 0","04/30/2022","DBA: MR JALAPENO LLC                            MR JALAPENO LLC                             3788 RAILROAD AVE,                             PITTSBURG, CA  94565-5206","1315 GLORIA DR                              PITTSBURG, CA  94565","ORI","","","22","0708"
"624473","Active","21 | 0","04/30/2022","DBA: YOUR MARKET                            LEE, SANG  CHUL                             1460 48TH AVE,                             SAN FRANCISCO, CA  94122","","PER","7","OLD REPUBLIC TITLE COMPANY 1000 BURNETT AVE STE 400 CONCORD, CA  94520-2088","24","3800"
"624594","Active","48 | 0","04/30/2022","DBA: PEPPERTREE LOUNGE                            SAS PEPPERTREE, LLC                             1848 WHIPPLE RD,                             UNION CITY, CA  94587-1928","","PER","","CRESCENT LAND TITLE CO 890 3RD ST CRESCENT CITY, CA  95531","22","0113"
"624819","Active","20 | 0","04/30/2022","DBA: NEW INDIA BAZAR                            TRIVALLEY INDIAN SUPERMARKET INC                             3160 SANTA RITA RD, STE. B2 & B3,                             PLEASANTON, CA  94566","885 YOSEMITE WAY                              MILPITAS, CA  94566","ORI","","","22","0111"
"624958","Active","41 | 0","04/30/2022","DBA: SQUEEZE BURGER                            E. P. DAVID REAL ESTATE LLC                             1630 K ST,                             SACRAMENTO, CA  95814-4020","5746 LONETREE BLVD                              ROCKLIN, CA  95765","PER","7","CAPITOL CITY ESCROW 3838 WATT AVE STE F610 SACRAMENTO, CA  95821","23","3405"
"624969","Active","02 | 0","08/12/2021","DBA: L. ROBERTS & REED LLC                            L. ROBERTS & REED LLC                             55 ENTERPRISE CT, STE 3 & 4,                             NAPA, CA  94558-7590","1420 3RD ST, STE 12                              NAPA, CA  94559-2859","ORI","","","27","2802"
"625245","Active","41 | 0","01/31/2022","DBA: EL RINCON AMERICANO, LLC                            EL RINCON AMERICANO, LLC                             1514 E MANNING AVE,                             REEDLEY, CA  93654-2346","","FID","8","","21","1012"
"625339","Issued-Temp.","30","09/14/2021","PANDEY, DHRUBA                             46 CALEDONIA ST,                             SAUSALITO, CA  94965-2117","3325 RHEEM AVE                              RICHMOND, CA  94804-1196","PER","","MCGOVERN ESCROW SERVICE 436 14TH ST SUITE 1015 OAKLAND, CA  94612","27","2109"
"625342","Active","21 | 0","04/30/2022","DBA: SHOPPING BAG  MARKET & LIQUOR                            HENG, SOKTHAVY                             999 E 6TH ST,                             BEAUMONT, CA  92223-2305","","PER","","ACE ESCROW INC 1725 S NOGALES ST STE 104 ROWLAND HEIGHTS, CA  91748","8","3302"
"625463","Issued-Temp.","30","09/14/2021","MATOI INC                             4212 CONVOY ST,                             SAN DIEGO, CA  92111","1725 29TH ST                              SAN DIEGO, CA  92102","PER","7","HERITAGE ESCROW 2550 5TH AVE STE 800 SAN DIEGO, CA  92103","10","3710"
"625514","Active","41 | 0","11/30/2021","DBA: SPRING THAI RESTAURANT                            SPRING THAI INC.                              8099 LA PLAZA , STE A,                             COTATI, CA  94931-4253","","PRM/FID","8","","27","4908"
"625754","Issued-Temp.","30","09/14/2021","DBA: SCHOOLHOUSE GRILL                            ADAMS, CATHERINE LIANE                             15782 CALIENTE CREEK RD,                             CALIENTE, CA  93518","","PER","","NONE","6","1500"
"625838","Active","82 | 0","04/30/2022","DBA: ANDERSON FAMILY VINEYARD                            ANDERSON FAMILY VINEYARD, LLC                             20120 NE HERRING LN,                             NEWBERG, OR  97132","","ORI","","","75","9999"
"625908","Issued-Temp.","30","09/14/2021","DBA: 3 WAY MARKET AND GAS                            RH&K GROUP CORP                             1825 E CALIFORNIA AVE,                             BAKERSFIELD, CA  93307-1900","11400 QUEENSBURY DR                              BAKERSFIELD, CA  93312-7056","PER","7","FIRST AMERICAN TITLE 1001 W TEHACHAPI BLVD B300 TEHACHAPI, CA  93561","6","1500"
"626080","Issued-Temp.","30","09/14/2021","DBA: HYDE PARK LOUNGE                            SONA INC                             1070 N 4TH ST,                             SAN JOSE, CA  95112-4941","1070 N 4TH ST                              SAN JOSE, CA  95112-4941","PER","8","BUSINESS & ESCROW SERVICE CENTER 3031 TISCH WAY 310 SAN JOSE, CA  95128","25","4313"
"626339","Issued-Temp.","30","09/14/2021","DBA: LA QUINTA MOUNTAIN DUNES                             PGAW BEVCO, LLC                             49-499 EISENHOWER DR, STE 1,                             LA QUINTA, CA  92253","5340 LBJ FREEWAY, STE 1400                              DALLAS, TX  75240","PER","","CALIFORNIA BUSINESS ESCROW INC 1748 MAIN ST ESCALON, CA  95320-1927","8","3320"
"626428","Active","82 | 0","04/30/2022","DBA: ATWATER VINEYARDS                            ATWATER VINEYARDS, LLC                             5055 NY ROUTE 414,                             BURDETT, NY  14818","","ORI","","","75","9999"
"626584","Issued-Temp.","30","09/14/2021","DBA: TOOLEY OIL COMPANY                            MICNAN LLC                             8830 E STOCKTON BLVD,                             ELK GROVE, CA  95624","","PER","7","","23","3407"
"626586","Issued-Temp.","30","09/14/2021","DBA: DC PRADO CORP                            DC PRADO CORP.                             2105 EDISON HWY, STE P9-P10,                             BAKERSFIELD, CA  93305-5516","107 DEL PLAYA DRIVE                              BAKERSFIELD, CA  93307","PER","7","CENTRAL CALIFORNIA ESCROW 9101 CAMINO MEDIA STE 200 BAKERSFIELD, CA  93311","6","1500"
"626593","Issued-Temp.","30","09/14/2021","DBA: KAENA WINE COMPANY                            KAENA WINE COMPANY                             800 E HIGHWAY 246,                             SOLVANG, CA  93463","PO BOX 645                              SOLVANG, CA  93464-0645","PER","","","13","4200"